{
  "disposition_set_id": "DELTA-CASE-B",
  "records": [
    {
      "acs_ids": [
        "ACS-B01-01"
      ],
      "risk_id": "B-01",
      "status": "runtime"
    },
    {
      "acs_ids": [
        "ACS-B02-01"
      ],
      "risk_id": "B-02",
      "status": "runtime"
    },
    {
      "acs_ids": [
        "ACS-B03-01"
      ],
      "risk_id": "B-03",
      "status": "runtime"
    },
    {
      "acs_ids": [
        "ACS-B04-01"
      ],
      "risk_id": "B-04",
      "status": "runtime"
    },
    {
      "acs_ids": [
        "ACS-B05-01"
      ],
      "risk_id": "B-05",
      "status": "runtime"
    },
    {
      "acs_ids": [
        "ACS-B06-01"
      ],
      "risk_id": "B-06",
      "status": "runtime"
    }
  ],
  "signature": {
    "algorithm": "Ed25519",
    "domain": "dispositions",
    "key_id": "key.governance_forum_b",
    "payload_hash": "53132cf987323b683a2e666bf8f56423d094f83e89ce3cef46d4a95882a611be",
    "signature_b64": "HU0VloRVDaRlaQNMHx8HOLvQrb48C/2d4drZNJGu8wfI49Z8MHEMuecs72RiYH+TfgLbwDjeSTWaBzbQO+g/Dg==",
    "signing_time": "2026-01-22T15:12:00Z"
  },
  "version_binding_ref": "VB-CASE-B-1.0"
}
